{
  "$schema": "https://raw.githubusercontent.com/viblocks/viv-workflows/main/schemas/issue-tracker-adapter-contract.schema.json",
  "version": "1.0.0",
  "binary_name": "issue-tracker",
  "config_file": ".issue-tracker.toml",
  "verbs": {
    "view":    { "required": true,  "args": "<ID>",                                          "description": "Print issue details." },
    "query":   { "required": true,  "args": "--search <text> [provider-specific flags]",    "description": "Search issues. Adapters pass through provider-specific flags." },
    "create":  { "required": true,  "args": "--title <t> --body <b> [--labels <l>]",        "description": "Create an issue. Labels must already exist provider-side." },
    "begin":   { "required": true,  "args": "<ID>",                                          "description": "Move issue to 'work in progress' state. Provider-side state name comes from adapter's state-mapping." },
    "finish":  { "required": true,  "args": "<ID> --evidence <file>",                       "description": "Move issue to 'done' state, attaching the evidence file as a comment. Errors if --evidence is missing." },
    "comment": { "required": true,  "args": "<ID> --body-file <file>",                      "description": "Append a comment without changing state." },
    "close":   { "required": true,  "args": "<ID> [--reason <r>]",                          "description": "Move to 'done' without evidence. Use for stale/duplicate/won't-fix. The evidence-gate hook will block this verb if used in a change-flow context where evidence is required." },
    "cancel":  { "required": false, "args": "<ID>",                                          "description": "Move to 'cancelled' state. Optional; adapters may exit 3 if provider has no cancel state." },
    "prefix":  { "required": true,  "args": "",                                              "description": "Print the configured issue ID prefix (e.g. 'VI'). Used by audit-trail hooks to derive the trailer regex without hardcoding." },
    "pattern": { "required": true,  "args": "",                                              "description": "Print a regex that matches valid issue IDs (e.g. 'VI-[0-9]+'). Used by hooks and CI gates." },
    "verify":  { "required": true,  "args": "",                                              "description": "Run provider-side preflight: validate auth, team/project existence, labels, workflow states. Exit 0 if all checks pass, 1 if recoverable, 2 if fatal." }
  },
  "known_adapters": [
    { "provider": "linear", "repo": "https://github.com/viblocks/issue-tracker-linear", "status": "beta" }
  ]
}
